<#setting number_format="#">
<?xml version="1.0" encoding="UTF-8"?>
<Message xsi:schemaLocation="urn:Declaration:datamodel:standard:CN:MSAShipFilingDeclaration-0.1 MSAShipFilingDeclaration-0.1.XSD" xmlns="urn:Declaration:datamodel:standard:CN:MSAShipFilingDeclaration-0.1" xmlns:xsi="http://www.w3.org/2001/XMLSchema-instance">
	<MessageHead>
		<MessageID>${messageHead.messageID!''}</MessageID>
		<MessageType>MSA0001</MessageType>
		<MessageMark>0</MessageMark>
		<SenderID>${messageHead.senderID!''}</SenderID>
		<ReceiverID>${messageHead.receiverID!''}</ReceiverID>
		<ActualSenderID>${messageHead.actualSenderID!''}</ActualSenderID>
		<ActualReceiverID>${messageHead.actualReceiverID!''}</ActualReceiverID>
		<SendTime>${messageHead.sendTime!''}</SendTime>
		<Version>${messageHead.version!''}</Version>
		<SendNum>1</SendNum>
	</MessageHead>
	<MessageBody>
		<Declaration DataModelVersion="0.1" Xmlns="urn:Declaration:datamodel:standard:CN:MSAShipFilingDeclaration-0.1" Version="0.1">
			<Archive>
				<ApplyId><![CDATA[${messageBody.bodyElement.applyId!''}]]></ApplyId>
				<IMO><![CDATA[${messageBody.bodyElement.imo!''}]]></IMO>
				<VesselNameEn><![CDATA[${messageBody.bodyElement.nameEn!''}]]></VesselNameEn>
				<VesselNameCn><![CDATA[${messageBody.bodyElement.nameCn!''}]]></VesselNameCn>
				<CallSign><![CDATA[${messageBody.bodyElement.callName!''}]]></CallSign>
				<GrossTonnage><![CDATA[${messageBody.bodyElement.totalTon!''}]]></GrossTonnage>
				<NetTonnage><![CDATA[${messageBody.bodyElement.netTon!''}]]></NetTonnage>
				<VesselType><![CDATA[${messageBody.bodyElement.shipType!''}]]></VesselType>
				<DeepDraft><![CDATA[${messageBody.bodyElement.draftDepth!''}]]></DeepDraft>
				<DeadWeightTonnage><![CDATA[${messageBody.bodyElement.capacityTon!''}]]></DeadWeightTonnage>
				<MaxCrewSpeed><![CDATA[${messageBody.bodyElement.maxSpeed!''}]]></MaxCrewSpeed>
				<FlagCode><![CDATA[${messageBody.bodyElement.innerCommerceId!''}]]></FlagCode>
				<MMSI><![CDATA[${messageBody.bodyElement.mmsi!''}]]></MMSI>
				<BuildFactory><![CDATA[${messageBody.bodyElement.manufacturer!''}]]></BuildFactory>
				<VesselLength><![CDATA[${messageBody.bodyElement.totalLength!''}]]></VesselLength>
				<VesselBreadth><![CDATA[${messageBody.bodyElement.width!''}]]></VesselBreadth>
				<VesselDeapth><![CDATA[${messageBody.bodyElement.height!''}]]></VesselDeapth>
				<HorsePower><![CDATA[${messageBody.bodyElement.shipHorsepower!''}]]></HorsePower>
				<HostNum><![CDATA[${messageBody.bodyElement.engineCount!''}]]></HostNum>
				<HostPower><![CDATA[${messageBody.bodyElement.enginePower!''}]]></HostPower>
				<VesselHost><![CDATA[${messageBody.bodyElement.ownerCn!''}]]></VesselHost>
				<CountryCode><![CDATA[${messageBody.bodyElement.nationalityEn!''}]]></CountryCode>
				<HomeportCode><![CDATA[${messageBody.bodyElement.nationalityPort!''}]]></HomeportCode>
				<ShipRegistrationNumber>船舶登记号</ShipRegistrationNumber>
				<FirstRegistrationNum>初次登记号</FirstRegistrationNum>
				<ShipInspectionRegistrationNum>船检登记号</ShipInspectionRegistrationNum>
				<BrandBookNo>牌簿号</BrandBookNo>
				<ShipRiverBoatFlag>海船内河船标志</ShipRiverBoatFlag>
				<Route>航线</Route>
				<CompletionDate><![CDATA[${messageBody.bodyElement.dateBuild!''}]]></CompletionDate>
				<PropellerNumber><![CDATA[${messageBody.bodyElement.engineCount!''}]]></PropellerNumber>
				<ApprovedWindRating>核定抗风等级</ApprovedWindRating>
				<MinimumFreeboard>最小干舷数字</MinimumFreeboard>
				<Slotting>箱位</Slotting>
				<ParkingSpacesNum>车位</ParkingSpacesNum>
				<GuestsNum>客位</GuestsNum>
				<Speed>航速</Speed>
				<ShipOperators>船舶经营人</ShipOperators>
				<ProvincialMaritimeOrganisation>所属省级海事机构</ProvincialMaritimeOrganisation>
				<SocietyCode>船级社代码</SocietyCode>
				<MinimumSafeManningNum>最低安全配员人数</MinimumSafeManningNum>
				<LifeSavingEquipmentMaxNum>救生设备最大人数</LifeSavingEquipmentMaxNum>
				<ICCard>IC卡号</ICCard>
				<BarCode>条形码</BarCode>
				<FlagShipNo>船舶标志号</FlagShipNo>
				<IssuerFlag>发卡标志</IssuerFlag>
				<RegistrationMark>登记标志</RegistrationMark>
				<ShipClassification><![CDATA[${messageBody.bodyElement.shipType!''}]]></ShipClassification>
				<RecodeDepart><![CDATA[${messageBody.bodyElement.recordDepartment!''}]]></RecodeDepart>
				<Opertaion><![CDATA[${messageBody.bodyElement.recorder!''}]]></Opertaion>
				<Memo><![CDATA[${messageBody.bodyElement.remark!''}]]></Memo>
			</Archive>
		</Declaration>
	</MessageBody>
</Message>
